{
  "schemaVersion": "1.0",
  "module": {
    "repository": "labview-benchmark-actor-plugins/replay",
    "id": "replay",
    "version": "1.0.0"
  },
  "source": {
    "repository": "labview-benchmark-actor-plugins/replay",
    "ref": "refs/tags/v1.0.0",
    "commit": "aaaaaaaaaaaaaaaaaaaaaaaaaaaaaaaaaaaaaaaa"
  },
  "release": {
    "tag": "v1.0.0",
    "publishedAt": "2026-10-31T00:00:00Z",
    "immutable": true,
    "url": "https://github.com/labview-benchmark-actor-plugins/replay/releases/tag/v1.0.0"
  },
  "toolchain": {
    "labviewVersion": "2026",
    "labviewBitness": "64",
    "vipmVersion": "26.3.2",
    "runner": {
      "os": "windows",
      "class": "self-hosted"
    }
  },
  "artifacts": {
    "releaseAssets": [
      {
        "id": "replay-source",
        "version": "1.0.0",
        "buildSpec": "replay",
        "kind": "source-distribution",
        "format": "zip",
        "asset": {
          "fileName": "replay-1.0.0.zip",
          "sha256": "aaaaaaaaaaaaaaaaaaaaaaaaaaaaaaaaaaaaaaaaaaaaaaaaaaaaaaaaaaaaaaaa",
          "sizeBytes": 1048576
        }
      }
    ],
    "sboms": [
      {
        "subjectAssetId": "replay-source",
        "subjectAssetVersion": "1.0.0",
        "subjectAssetKind": "source-distribution",
        "format": "CycloneDX",
        "specVersion": "1.5",
        "asset": {
          "fileName": "replay-1.0.0.cdx.sbom.json",
          "sha256": "bbbbbbbbbbbbbbbbbbbbbbbbbbbbbbbbbbbbbbbbbbbbbbbbbbbbbbbbbbbbbbbb",
          "sizeBytes": 32768
        }
      }
    ]
  },
  "dependencies": [],
  "validation": {
    "status": "passed",
    "buildOutputs": [
      {
        "buildSpec": "replay",
        "outputType": "source-distribution",
        "outcome": "built",
        "includedInReleaseAsset": "replay-1.0.0.zip",
        "runUrl": "https://github.com/labview-benchmark-actor-plugins/replay/actions/runs/1234567890"
      },
      {
        "buildSpec": "Launcher",
        "outputType": "executable",
        "outcome": "executed",
        "runUrl": "https://github.com/labview-benchmark-actor-plugins/replay/actions/runs/1234567890"
      }
    ],
    "tests": [
      {
        "name": "package-build",
        "status": "passed",
        "runUrl": "https://github.com/labview-benchmark-actor-plugins/core/actions/runs/1234567890"
      }
    ]
  }
}